job_link,position,company name,job description,salary,workplace_type,skills,insights
https://www.linkedin.com/jobs/view/3571652742/?eBP=CwEAAAGH0jVZ-lsE5NoSvguuhfWlXDo9EpJCXY4icGQZAYkxnQhrjW5Qb-8zZEtJ1wTLfFcoNgbo3Uvn34hkEZlJhPwr0uBYmdMM7bv8U6Ol-HMB8wWrBAWJsaQ2bcziDzk7U0c0IOzOHm72Wd-AlggEy1CjoSOauToNGXkJStSYZVTJXdFDIiETKPOF6Vh7hiBdS6TjAXQbr1trwrg5Op5d3c0luDO8tHPLwF2Lxi4muKocqINmdiQiJolZQHmDtB3hy4h_PdmKf88nSPnwrvGJgfl9NhcTQfXgJIJ-isVGjepTpM0OQH0dkW3vGKH4ySkmKuCRhlyY2us33G-3CWASMW-xw_FoB_-DGqylYIDo23_ajuVObNaf-Y6sWgklibgNj4A6Bbk&recommendedFlavor=IN_NETWORK&refId=MT4J1lUmhNk2l6qmLBcJ9w%3D%3D&trackingId=PoFCmGttETLoLBAfu42MnA%3D%3D&trk=flagship3_search_srp_jobs,Business Analyst,Odoo,"About the job
El departamento de Odoo España Business Service está buscando a profesionales como tú, que nos ayuden a cumplir nuestra misión: Liderar el mercado español de las ERPs, al mismo tiempo que nos damos a conocer y hacemos que las empresas sean más eficientes y productivas. En Odoo creemos en tu talento, y estamos dispuestos a darte confianza, autonomía y escuchar tus propuestas. Buscamos a una persona proactiva, con gran capacidad de aprendizaje y sobre todo, que tenga las mismas ganas que nosotros de hacer crecer este proyecto.

En qué consistirá tu trabajo...

Como Business Analyst, estarás en contacto directo con los clientes para ayudarles en el buen uso del software Odoo . Por lo tanto, tu principal rol será analizar sus necesidades, identificar puntos débiles o de mejora y ayudar a encontrar la mejor solución para cada unidad de negocio. Así pues, serás responsable de ofrecer la mejor solución de gestión a tus clientes.

Trabajarás en varios proyectos diferentes al mismo tiempo. En las primeras semanas, te involucras rápidamente en tus primeros proyectos recibiendo el apoyo de compañeros más experimentados. Irás aumentando progresivamente tu nivel de autonomía, al mismo tiempo que trabajas en equipo con grandes profesionales de diferentes sectores. Queremos destacar también, que no tendrás tiempo de aburrirte, ya que, ¡Cada proyecto es siempre diferente!

Además, impartirás sesiones de formación personalizadas. Por otra parte, serás un apoyo estratégico enfocado al crecimiento de nuestra red de socios a nivel mundial . En este sentido, te responsabilizarás de la formación de nuestros partner, a los que ayudarás a implementar los proyectos de sus clientes, y por tanto, a convertirse en expertos en Odoo.

El principal objetivo del rol Business Analyst es implantar nuestro software ERP, e impartir formación y asesoramiento personalizado para cada cliente.

Te ofrecemos...

Tendrás la oportunidad de trabajar con empresas grandes (Medium Market & Corporate). Tratarás con compañías de más de 100 empleados y gestionarás grandes proyectos a largo plazo, por lo que tendrás bastante capacidad de decisión. Además, te damos la posibilidad de formar parte de un equipo internacional dinámico y competente con el que podrás aprender, y consolidar tus conocimientos.
Además, con el tiempo tendrás la posibilidad de crecimiento dentro de nuestra empresa, pudiendo llegar a ser Director de Proyectos en una empresa líder a nivel internacional en el sector IT.
Desde Odoo queremos que sepas que no nos consideramos una compañía convencional con trabajos monótonos y aburridos que imposibilitan el desarrollo profesional y personal. Nuestra cultura empresarial pretende dejar rienda suelta a tu creatividad, por tanto las personas proactivas con gran imaginación son bienvenidas. Queremos que disfrutes de tu trabajo, y que sientas que eres una parte imprescindible de nuestra gran comunidad.

Responsabilidades
Implementación de proyectos (80% de tu tiempo)
Ganar la confianza de tus clientes
Analizar las necesidades del cliente y proponer soluciones
Implementar las soluciones acordadas (configuración y desarrollo)
Convierte a tu cliente/socio en un campeón de Odoo (formación)
Gestión de proyecto - Seguir el proyecto y comunicar su estado y las tareas en curso
Organización y seguimiento de las implantaciones de Odoo
Mejoras internas (20% de tu tiempo)
Feedbacks a los Product Owners para mejorar el producto
Coaching & Training
Feedbacks para la mejora de tu departamento

Requisitos
Hablar español e inglés fluido/ otro idioma será un plus
Multitasking
Buena capacidad de comunicación
Autónomo, flexible y proactivo
Afinidad con el mundo de la informática
Permiso de trabajo válido para España

Sera un plus si tienes....
Experiencia en la implantación de software de gestión (ERP)
Conocimientos técnicos (XML, Python, JS, HTML)",,Hybrid,Comunicación and Capacidad de análisis,Full-time · Entry level
https://www.linkedin.com/jobs/view/3586168435/?eBP=CwEAAAGH0jhcIkdR85oZjHJt7VmFApWhD5iEQbJE1rjj0n4R71tpp_hVwaBgtpz8uC3zQMa7NaqcncP6m40p4yhAk4WPi8BiGLRtPfiW2TVKsDvC_HryV8nJ38SA55htW3Az9Ce0Z4Mwxenvy99eckdsbCpBNZHFMYcj7EyRFLLrIn2ufrABt5qm-JAqmjCy8Qa4I6hnRx2S0XhGDim0MMOUYAIX1E7uD2-vd_821XZFQVSxqKDid36MR0VuOrbJpSpxrV3r3Yk6dIl0rAwUOCOGuN-XDEehpZe7w_t6lwG0oflV6ibXuZeOq_baHDWV8Ii8WgUxQHQoZsrm1O9-UtpLkkd_A7CKRyMhroBPH6Xdt-WZnfK7UvS1bBdopOxYXPE1QCOrkik&recommendedFlavor=IN_NETWORK&refId=lN3NRG8kjao49oQPDgHZjg%3D%3D&trackingId=eMQ3bvK1ED0Vyeg6UwDiGQ%3D%3D&trk=flagship3_search_srp_jobs,Consultor/a Junior SAP BI,Minsait,"About the job
More digital. More human. More Minsait.
Somos una empresa líder global de tecnología y consultoría digital que conecta personas, tecnología y negocios para generar crecimiento, transformación e impacto positivo y sostenible.

Buscamos personas de Grados técnicos preferiblemente Ingenierías/Informática con ganas de trabajar en nuestra unidad de Digital Business Technologies como Consultores SAP BI, con ganas de trabajar en nuestros equipos multidisciplinares.

¿Cuál es el reto que te proponemos?

Desarrollarás en entornos SAP con tecnologías punteras como HANA, Fiori, etc.
Estarás en contacto continuo con las novedades tecnológicas, impulsando la transformación digital.
Participarás en proyectos y desarrollos que tienen una alta visibilidad y que marcan la diferencia con soluciones disruptivas y especializadas para toda la cadena de valor.


¿Qué esperamos por tu parte?

- Que poseas la titulación de Grados técnicos preferiblemente Ingenierías/Informática o similares.
- Conocimientos SAP BI
- Preferiblemente con Master SAP
- Inglés B2
- Persona con iniciativa, ganas, capacidad de análisis y trabajo en equipo.

Motivos por los que te encantará ser un #Minsaiter:

Conciliación y equilibrio: 32 días laborables de descanso, jornada intensiva en verano y teletrabajo.
Carrera profesional y formación continua adaptada a tus necesidades y motivaciones.
Contrato indefinido y retribución competitiva, seguro de vida y acceso a planes de retribución flexible.
Programa de bienestar con acceso a una red de gimnasios, servicio de telemedicina en línea gratuita y otras ventajas.

Minsait, technology for a more human future!
Nuestro compromiso es promover ambientes de trabajo en los que se trate con respeto y dignidad a las personas, procurando el desarrollo profesional de la plantilla y garantizando la igualdad de oportunidades en su selección, formación y promoción ofreciendo un entorno de trabajo libre de cualquier discriminación por motivo de género, edad, discapacidad, orientación sexual, identidad o expresión de género, religión, etnia, estado civil o cualquier otra circunstancia personal o social.",,Remote,"Inglés, Trabajo en equipo, Inteligencia empresarial, and Capacidad de análisis",Full-time · Entry level
https://www.linkedin.com/jobs/view/3589570453/?eBP=CwEAAAGH0jhcIj1G8RQulFOg4CA79EIAdV9qF5zSemrvzALrc061GhfYqUHb8OXnn6yTPbhk_gNCpt_MtNFIERoVvmQfcOE-Y1-0MhrdDHg8SjQXuHZXEtECqP2CUdxrAMbU4CM6JojDob4gAL7M6DA4aPmwLh_1rDR9vB81LncPQV3NydZk4DfgPnObHNTbIR42gSk9ZKFrZyiZ-6uwI4iD6jaYpWA4uC-xCe4zoUUtMNYAy69hi2O_-bAQFfw3XK0ZXwYSTtHmWox6BGaHTFgCCZLVv15uxGiFBX9mu-MtVkx865B9deN3CBrp_mj4_eehRwBviD88E-Pa3TPU31ne4KwLrp7IW80PFHQ3adAnDQhN-sINNg-Eta3AqzQQgasxhSM-vGtVXFld-OjdY7EZ2Km5RtizXNo&recommendedFlavor=SCHOOL_RECRUIT&refId=lN3NRG8kjao49oQPDgHZjg%3D%3D&trackingId=w5NeLcGpo3mpCEXX9cLfoQ%3D%3D&trk=flagship3_search_srp_jobs,Junior Service Engineer,Selectra,"About the job
La visión de Selectra es que nadie tenga que preocuparse por los gastos de su hogar o negocio. Para ello, solucionamos la gestión de estos gastos - como luz, gas, internet, telefonía, seguros o alarmas - ahorrando al cliente tiempo y dinero.

Somos una multinacional con presencia en 16 países y estamos centrados en las personas. En apenas 8 años hemos conseguido ser el comparador nº 1 de luz y gas y ahorrar a nuestros clientes 57,2 millones de euros en 2022 en España, Portugal y México y LATAM… ¿La clave de nuestro liderazgo? Nuestro equipo. Todos con el mismo objetivo: simplificar la vida de las personas.

NUESTRO ADN
We make it BIG. Somos ambiciosos, enérgicos e inconformistas
We make it EASY. Somos constructivos, amables y empáticos
We make it YOURS. Somos implicados, responsables y exigentes.
We make it HAPPEN. Somos proactivos, humildes y resolutivos
We make it TOGETHER. Somos serviciales, cooperativos y un equipo.

CÓMO JUNIOR SERVICE ENGINEER …
Queremos que formes parte de nuestro equipo técnico aportando tus conocimientos y tu experiencia para conseguir nuestros objetivos en los distintos proyectos.
Misión
Entre las distintas funciones del puesto están:
Desarrollo y mantenimiento de los procesos de automatización necesarios para los distintos proyectos.
Gobernanza del dato del CRM y del catálogo de tarifas.
Crear y mantener extracciones y exportaciones automáticas de datos entre distintos sistemas.
Colaborar en el correcto uso y configuración del sistema de tickets.
Dar soporte al resto de departamentos técnicos es casos puntuales de necesidad

Marcarás la diferencia en Selectra si…
Grado en Ingeniería Electrónica, Informática o Ciencia, Gestión e Ingeniería de Servicios.
Experiencia mínima de 6 meses en el puesto a desempeñar.
Experiencia demostrable en programación web, tanto en front como en back.
Inglés fluido B2
Experiencia en el uso de bases de datos
Valorable experiencia en entornos cloud

QUÉ ESPERAMOS DE TI
Gestión eficiente del tiempo para cumplir los objetivos establecidos y tareas.
Capacidad de integración para trabajar con diversos equipos.
Adaptabilidad y flexibilidad a los cambios, tanto del equipo como de Selectra por el crecimiento continuo.
Habilidades comunicativas para estar en contacto con las diferentes personas de cada proyecto o tarea.
Implicación y compromiso con su equipo y con Selectra.

QUÉ OFRECEMOS
📍 Ubicación:
Sede Madrid Centro (28028)
Modalidad híbrida
EGran desarrollo y retos junto a una empresa joven e internacional.
📝 Contrato Indefinido con 6 meses de período de prueba, por ley
🕑 Flexibilidad horaria, jornada completa 40h/semana:
Horario flexible de entrada de lunes a jueves de 8h a 9:30h.
1 hora de comida.
Horario de salida, de lunes a jueves, a partir de las 17:15h (si entras a las 8:00h).
🚀 ¡Viernes tardes libre! Horario intensivos: de 8h a 15h
💰 Condiciones económicas:
Salario según perfil.
Evaluación de desempeño tras la superación del período de prueba, y revisión salarial acorde al desempeño y competencias.
🏖️ 23 días laborables de vacaciones
📚 Programas de formación y desarrollo profesional.
📖 Biblioteca Selectra
📢 Beneficios con opción de contratación a cargo del trabajador:
Retribución flexible a través de Cobee: ticket Restaurante, Transporte, Guardería y Formación.
Seguro médico completo salud y dental con Sanitas
¡Tu dinero al instante con Payflow!
Descuentos en cine y espectáculos a través de Diverclick
Gympass
Descuento con Brooklyn Fitboxing Guindalera
Acuerdo de beneficios con BBVA.",,Hybrid,"Metodologías ágiles, Trabajo en equipo, Inglés, Capacidad de análisis, and Bases de datos",Full-time
https://www.linkedin.com/jobs/view/3584640506/?eBP=CwEAAAGH0jhcI6qsRf_YQgp4kooVhZdmo5JWgbort3HW_FjnuOAcA3Ez_2A5AsyUp0aZI-mnQhh-Yc96-ihcUc2JkZeUDDxNEp_BMObkLEj-Uy5uqbDGWuUjcKv0YHFtmsXHaclh-3mAgImG4QdoQ8Un93SodZLPQtOYRNn-_jVWKZTseW9k7uc7AP4NclCDZ4JU4-CtqWMzZnGyuJkawvRfhTl1EeOmAxMF2uxdkpOg3EW9gLgWeUCOw6mSJsdVO7cw6wmgiwNu8jxUFZmnv9Yp5yf5A3pKYANUV1Q67oMG-SSF3IgPtdCUMURBwEtRinghiEedvhv7_lrVr2aF7nCeQrlJTgCCQTYc4hmuQPFuHYP_tDsqXYZeeMv8Sw&recommendedFlavor=ACTIVELY_HIRING_COMPANY&refId=lN3NRG8kjao49oQPDgHZjg%3D%3D&trackingId=DIdlpjgB6akzTg5Ge3FROg%3D%3D&trk=flagship3_search_srp_jobs,Junior Marketing Analyst,Norma,"About the job
Norma Doors, el mayor fabricante de puertas a nivel nacional, ubicado en San Leonardo de Yagüe (Soria), busca incorporar a un analista junior de marketing.
Inicialmente, esta persona formará parte del equipo de marketing actual y trabajará de forma conjunta con el departamento comercial. Una vez formada, el objetivo es que lidere el departamento de marketing reportando directamente a dirección comercial.
Responsabilidades que deberá ir adoptando:
Definir las campañas offline y online (con medios propios y externos), coordinar su ejecución y analizar su rendimiento.
Responsable de marketing online, posicionamiento y gestión de redes sociales
Posicionamiento y actualización página web (Wordpress).
Crear presentaciones comerciales, material de ventas (folletos, brochures, argumentarios, etc.) para apoyar al equipo comercial.
Garantizar que los materiales de marketing creativo se sometan a revisiones periódicas y se adhieran a las directrices de la marca.
A nivel internacional definir y ejecutar el marketing plan en función del mercado objetivo.
Imagen corporativa - definir y aplicar la política de marketing
Branding - Generar branded content
Comunicación interna: apoyar y desarrollar la estrategia de comunicación interna
Comunicación institucional y relaciones con partners, medios, asociaciones y patrocinios

Perfil que buscamos:
Formación en: marketing/ publicidad/ periodismo o similar.
Al menos 1 año de experiencia en un departamento de marketing (preferiblemente en el sector de la industria o B2B)
Nivel alto de inglés. Se valorarán otros idiomas especialmente el francés
Conocimiento de Redes sociales, WordPress, SEO, Mailchimp y programas de edición de vídeos. Habilidad en redacción de contenidos.
Perfil con visión estratégica y analítica. Clara vocación comercial y orientación al cliente.
Capacidad de ""autoorganizarse"" y ""autoaprender""

Ofrecemos:
- Contrato laboral indefinido, jornada completa
- Posibilidad de trabajar en un modelo híbrido (60% oficinas – 40% teletrabajo).
- Formar parte de en una empresa consolidada y líder en su sector, con elevado ritmo de crecimiento.
- Proyección de carrera y desarrollo profesional dentro de la empresa.
Otras consideraciones:
- Buscamos alguien que tenga cierta experiencia y resida actualmente en los alrededores de Soria o Burgos (a unos 50 minutos de la planta como máximo) ya que la presencialidad debe ser de al menos el 50%.
- La compensación fija total ofertada se encuentra entre los 20.000€ y los 25.000€ en función de la experiencia previa del candidato, capacidades demostrables, nivel académico, banda salarial actual... En función del punto de partida, se definirá un plan de carrera para ir mejorando condiciones en la medida que adopte responsabilidades
- No nos preocupa la edad de la persona, ni su situación actual en cuanto al empleo (empleada, desempleada, en sabático...)",,Hybrid,Para empresas (B2B),Full-time
https://www.linkedin.com/jobs/view/3580115811/?eBP=CwEAAAGH0jhcI5Vbupdgy9VhfcpgGQEi5ShWF65qP99-kZjud9dugt5x1XTEnme_JyTrpbbyo_XX5veVqqLb1Ng6idLQxZRDJEC76KaW-UdgL4qLOcBMB7v3BfSPI8huNIChKt2E3msxHPdQiFk1vitdh34s3zf2RsdBiO_OevEQwWDsyRHiq_bXJB3rp1OhNKClAcO9g_28FxQ279chivMsR7QpfNppSU3Rjr61Eya2NGLHCxnDzolxbTsDHvyCZUEgVdxscYZoKi03J6NovzZW2TmLmm_PA9OEZZBK4LrhOJ0xWFuTpbscUCkCv_g4AASh24LG5bB22mY3j43ZsgHPmhRwZp3mkXX4PlzZGJjj1BnzYB05DYyE_mNcZUpNNSjts66d&recommendedFlavor=COMPANY_RECRUIT&refId=lN3NRG8kjao49oQPDgHZjg%3D%3D&trackingId=4V%2FjbW%2BUgqBnFqqhXD3zSQ%3D%3D&trk=flagship3_search_srp_jobs,Analistas AWS,NTT DATA Europe & Latam,"About the job
¿Te gustaría formar parte de un equipo dinámico y con oportunidad de desarrollo profesional?
NTT Data somos todas las personas que la formamos. Un equipo de más de 139.000 profesionales, tan diverso cómo diversos son los 50 países en los que estamos presentes y los diferentes sectores en los que desarrollamos nuestra actividad; telecomunicaciones, sector financiero (banca y seguros), industria, utilities, sector público y sanidad.

Buscamos profesionales que tengan motivación por crecer y desarrollar una carrera profesional en el area de Big Data. Formarás parte de un equipo multidisciplinar, donde trabajarás en proyectos estables y punteros, acompañados de un plan de carrera personalizado y horario flexible.

Requisitos mínimos:
Ingeniero/a ó Analista de Datos.
Experiencia de al menos un año en AWS , Azure o Snowflake (obligatorio)
Experiencia en visualización de datos
Inglés medio-alto


Valorable:
Residencia en Andalucía

Te ofrecemos:
- Contrato estable: Indefinido a jornada completa.
- Beneficios sociales (flexibilidad horaria, opción de seguro médico para ti y tus familiares...).
- Flexibilidad y autonomía para gestionar el trabajo, plan de carrera y formación para fomentar tu crecimiento personal.
-Teletrabajo 100% o adaptado a tus necesidades.


deborahsoledad.matabenitez@emeal.nttdata.com",,Remote,Inglés and Visualización de datos,Full-time · Entry level
https://www.linkedin.com/jobs/view/3555240794/?eBP=CwEAAAGH0jhcI5vKKcvQAUmvtQWgsCZO6LNRRLLBOmbzutyZ_ba1Z1HeL2jrIVItAnBJ_HIL7VELS_WHFg9q6b98WQtWiuoF04-qRRbKGePubVIaUKyYGHsjJNjlbOU1lXKBKVAUrAMvl1gNH0TzcbyNovSRLuK8OfGeu4tRle4lUTgmJ-8t7D1P9p9sr-m1r2cDrGJoK6gNUJoj6wNsjppWgUQgbAPQcOabSC71HXnue1Az9CdpEzRY2qwf8rb1tcTJMOLFUBzsCItccR4u_bBGxzGeAw2DxlKBRESHtVaLCy8oj3Wme_TXD3AlnSv-KudMyQgBF1PrtC9eLnEW7GY-ZEM9-E-hHKW9vET04SZp5woiBRDdkvj_XUJuoBhBKgm_WKVkukU&recommendedFlavor=SCHOOL_RECRUIT&refId=lN3NRG8kjao49oQPDgHZjg%3D%3D&trackingId=qnJR%2BayFxS7Vb29xmK8f7g%3D%3D&trk=flagship3_search_srp_jobs,Business Intelligence & Operations,Adobe,"About the job
Our Company

Changing the world through digital experiences is what Adobe’s all about. We give everyone—from emerging artists to global brands—everything they need to design and deliver exceptional digital experiences! We’re passionate about empowering people to create beautiful and powerful images, videos, and apps, and transform how companies interact with customers across every screen.

We’re on a mission to hire the very best and are committed to creating exceptional employee experiences where everyone is respected and has access to equal opportunity. We realize that new ideas can come from everywhere in the organization, and we know the next big idea could be yours!

What You'll Do

Build and maintain fiscal year plan for Expert Support (included) and Ultimate (Paid) Support business
Serve as main financial operations partner to the Ultimate (Paid) Support sales and delivery teams
Partner with Finance on capacity planning & budgeting in a manner that supports business strategic objectives and prioritizes GTM motions with highest return on investment
Drive regular bookings & revenue forecasting and sales team accountability to targets and compensation plans
Identify and action expense efficiencies and/or investment tradeoffs
Analyze business dimensions, conduct scenario modeling, provide data-driven insights, and influence action on identified opportunities and risks
Represent the business’ financial position through crisp presentation and storytelling in both written and verbal communications
Collaborate with leaders and peers across the customer engineering organization and the digital experience sales organization
Drive business processes to improve efficiencies in core support business including vendor spend optimization
Establish financial model for development of proactive customer support tools and innovations that improve the speed and quality of support

What you need to succeed:

8+ year’s experience in business operations or finance roles; prior experience in Services and Support business operations and SaaS business models
Advanced analytical abilities with high standards for accuracy
Self-motivated with strong work ethic, desire to learn, attention to detail, and dedication to quality
Ability to sort through high complexity and present upshots in easily digestible formats
Ability to lead by influence and work effectively in highly matrixed organizations
Comfortable in a fluid environment that changes as the business evolves
Effective communicator – strong executive presence and verbal/written communications
Bachelor's degree in business, finance or related field or equivalent practical experience

At Adobe, you will be immersed in an exceptional work environment that is recognized throughout the world on Best Companies lists (http://www.adobe.com/careers/awards.html). You will also be surrounded by colleagues who are committed to helping each other grow through our unique Check-In (http://www.youtube.com/watch?v=hmL6uQZhYhw&list=UUlDSu3-Y4-BfI08784K-P4g&feature=share&index=1) approach where ongoing feedback flows freely.

If you’re looking to make an impact, Adobe's the place for you. Discover what our employees are saying about their career experiences on the Adobe Life blog (http://blogs.adobe.com/adobelife/) and explore the meaningful benefits (http://benefits.adobe.com/) we offer.

Adobe is an equal opportunity employer. We welcome and encourage diversity in the workplace regardless of race, gender, religion, age, sexual orientation, gender identity, disability or veteran status.",,Remote,Comunicación and Capacidad de análisis,Full-time · Entry level
