job_link,position,company name,job description,salary,workplace_type,skills,insights
https://www.linkedin.com/jobs/view/3574578063/?eBP=CwEAAAGH0jzD2Qlj8yKzVkWEbbviSHgv79-XSrUbkqWV1w3CmrG2KY54gsrM5kfbHPOHSBba5YMFawTUqtvrAe51INdo-TRZnJq26XdNfLs2fNmqkJ1ukPgcZ6xVPTxtSQZC3shZkjpLYy89CS3MbOvCvoTK6x-A8F5icOTThEdIsUJsi6opv6u9N_Z6OF8oTLoy2PNb96lYu6t9STBq1sBd2X7tL_GFoA3DBy52S3EMVC7XL4PPHr9yyN_Tao8xVF-Y0k-2yu-pHLr1nxyI7kt2K-tsPJlyBRO-r4Jwl6PDT8XbQ4AtR13ww9kk6sF0IZQ78q-7olq-1TpDbzE5S8f9zz_FNt1_5p5o-lTXgP0zYpyx5ofaMt9zJSL3poWNJvv_1G_VnUOvgQ&recommendedFlavor=IN_NETWORK&refId=ufquHJ%2F05o3zvsRg7oyA3Q%3D%3D&trackingId=mqkiMKf1sZZXUT2Gnux2QA%3D%3D&trk=flagship3_search_srp_jobs,Data Analyst - Courier Growth (They/She/He),Glovo,"About the job
About Glovo

We’re a Barcelona-based startup and the fastest-growing delivery player in Europe, Africa, and Western Asia. With food at the core of the business, Glovo delivers any product within your city at any time of day.

At Glovo, you’ll have the job of your life while working together towards our shared vision to give everyone easy access to anything in their city. We welcome top performers that will bring new ideas, diverse perspectives, and provide you the opportunities and freedom to grow and make a real impact on millions of lives… all while having fun!

We believe that diversity adds incredible value to our teams, our products, and our culture. We know that the best ideas and solutions come by bringing together people from all over the world and by fostering a culture of inclusion where everyone feels heard and has the chance to make a real impact. It's because of this that we are committed to providing equal opportunities to talent from all backgrounds.

In your application, please feel free to note which pronouns you use (For example: she/her/hers, he/him/his, they/them/theirs, etc).

Your Work-life Opportunity

Join us and become a key member of Glovo's Global operations team! We offer a challenging and dynamic environment with many opportunities for learning and development.

The couriers are the key player in Glovo’s marketplace. We are looking for an Analyst (Courier Growth) who will find the balance between creativity and data-driven objectivity in such a way that they carry out projects that seem impossible until they come true.

You will be in charge of providing data into the marketing initiatives of the courier growth team, from the moment the leads (courier candidates) see an advertisement till they register into our acquisition page and become couriers. Through analytics you will ensure that we always have the right amount of leads in every city.

Be a Part Of a Team Where You Will
Provide analytical support to the team of more than 20 countries, regional and local teams throughout deeper understanding of Glovo's operations model
Perform analysis to come up with insights to help improve KPIs in all the leads around the world
Understand and fix data reliability issues
Build tools and processes, to understand which channels give us the best quality leads
Help performance marketing department to adopt a data driven approach
Pull, understand and analyze all our performance marketing ads experiments
Own dashboards and build new tools to improve the visibility of metrics in the department
Understand which are the best top of funnel strategies
Develop analytical frameworks and models for the area and be able to instruct and communicate for all the department
Understand and deep-dive into the data to understand the reasons and the levers we can act upon to improve KPIs (and be accountable for them)
Evaluate strategic opportunities, performing a broad range of quantitative analyses and A/B tests
Contribute towards the continuous improvement of the Glover acquisition through out-of-the-box thinking
Understand local and regional needs, and put yourself in the skin of the courier - understand who they are
You Have
Bachelor in Engineering, Maths or any technological domain
Passionate about analytics: you enjoy deep diving into problems to find the root cause
Problem-solving skills: no problem is too small or too big
Excel / Google Sheets proficiency
Proficient in SQL and Python
JavaScripts is a plus
Knowledge of visualization tools like Tableau, Looker, Data Studio & Qlikview
Exceptional verbal and written communication skills (English is a must)
Proactive, organized, and obsessed with details
We are always looking for the best candidates, so if you think you would be a good fit even if you don't meet 100% of the requirements we would love to hear from you!

Experience Our Glovo Life Benefits
Enticing equity plan (if applicable)
Top-notch private health insurance
Monthly Glovo credit to spend on our restaurant products and zero delivery fee on all Glovo orders!
Discounted gym memberships
Flexible time off (take the time you need) and hybrid working model (own your time)
Enhanced parental leave including nursery support!
Online therapy and wellbeing benefit
What You’ll Find When Working At Glovo
Gas: Driven to deliver quality results quickly
Good Vibes: Bring positivity and communicate openly
Stay Humble: Self-aware and open to learning
Care: Uplift people and the planet
Glownership: Act as proud owners
High Bar: Focus on Top Performance
If you believe you match these values, we look forward to meeting you!

Wanna take a peek into what it's like to work at Glovo? Follow us on Instagram and like us on Facebook!

Glovo is transforming the way consumers access local goods, enabling anyone to get almost any product delivered in minutes. Our on-demand logistics connect customers with independent local couriers who acquire goods from any restaurant or store in a city, as well as deliver urgent packages for a variable fee. For additional information on Glovo, please visit https://about.glovoapp.com/","Benefits found in job post
Medical insurance",Hybrid,Comunicación and Inglés,Full-time · Entry level
https://www.linkedin.com/jobs/view/3591271321/?eBP=JOB_SEARCH_ORGANIC&recommendedFlavor=ACTIVELY_HIRING_COMPANY&refId=ufquHJ%2F05o3zvsRg7oyA3Q%3D%3D&trackingId=xDbGL6LDLJrgP1ap8IadLg%3D%3D&trk=flagship3_search_srp_jobs,Data Specialist / Business Analyst - Spain 1,Mindray,"About the job
Data Specialist / BI Analyst

Location: Madrid, Spain

(This role is office based in the Mindray Madrid office Monday to Friday / full time)

Highly Competitive Salary + Excellent Benefits + Career Enhancement

Reporting to National Operations Manager, Spain

Are you a data guru, fluent in Spanish and English (and preferably Mandarin, but not essential!), well versed in BI tools, data analysis, business performance and reporting looking to have immediate impact on a business in exponential growth – if so, we have a newly created opportunity you will love! To achieve our ambitious growth targets, we have fostered a culture of data driven innovation and product development.

Working with our highly successful Spanish team, based in Madrid, you will have outstanding commercial analytical skills, a comprehensive working experience of tools such as Tableau, or similar BI tools and will join our fun, highly professional, experienced team, to truly shape how we use our data to the fullest. This is an opportunity to really drive the success in Spain, so your impact will be significant.

Your Responsibilities

Provide business data analytics and sales analytics reports that allow stakeholders and executives team to make informed decisions
Facilitate the regional management leaders to conduct business reviews and proactive op portunity management that can improve the visibility of sales pipeline
Monitor and report operational KPI’s in HQ for senior management
You lead the review, analysis, and interpretation of sales trends across their applicable modalities for ensuring the delivery of sales and commercial KPIs
Provide support to internal stakeholders on BI functionality and data content within dashboard
Daily maintaining of opportunity management tool (C4C)
Manage user demands and system optimization requirements
Identify innovative workflow efficiencies and propose improvements to enhance data quality and timeliness
Build data management platform for regional business

What are we looking for in you?

Degree level educated in a subject with strong analytics focus
Proven comprehensive experience of BI tools / data analysis tools – Tableau, BI, Visual Basic or similar
Background in a data analysis, commercial data, BI based role
Fluent in Spanish and ENGLISH – both written and spoken
Ideally you will be fluent in Mandarin, this is not a mandatory requirement, but helpful!
Advanced knowledge of MS Office – particularly Excel
Ability work in Spain without the requirement of company sponsorship

What’s in it for you?

This is an excellent position for candidates that are really looking for a role with difference and one in which they can really make an impact. As a double-digit growth business with ambitious targets in our meteoric success, this is an opportunity to join a business built for future success where you can have a true impact on our business, and your own career development!",,Hybrid,"Analítica de datos, Análisis de datos, Tableau, Analítica, and Inteligencia empresarial",Full-time · Entry level
https://www.linkedin.com/jobs/view/3590680569/?eBP=CwEAAAGH0jzD2TZFdl21r0G2SaWRB7icCrSlgXAmKlq3PLO2hwHM7tReykuhNzaWV5vDcZdVdAQkaMAg1C176m6KEPUZMa8yDji33UGZRemZl-tLhEIcSc_M4ueAgNA5QoOFnDsSGwJlAuxKucbGqO3geWrZ8B_fRWsTA8_N2jSp3lUE2Wo_yuI8zIkD5EiGwiIyWCfIbqDhljS5v7E_u5zP7zUOvAIdKS09WRCT1IO20s6keckvPMWUQ53FiwYRsJvyIVmLYzl8J7q9SaaW0_ZiS_RP69rDlZ9YGwXbB6eN5Tx_PxNvI7IEOovAsJdnce2B-iNvKiSH3GREf0o7VII-uwatCzz7-Vq4VhhX-sP3ac6kOcaEqgEjgUFztXAKtgv8lXyASnNaGg&recommendedFlavor=ACTIVELY_HIRING_COMPANY&refId=ufquHJ%2F05o3zvsRg7oyA3Q%3D%3D&trackingId=I57OngLCIZBVVur3yrN8TQ%3D%3D&trk=flagship3_search_srp_jobs,Data Engineer / Data Analyst,Huxley,"About the job
Tenemos una vacante para un rol híbrido de Data Engineer / Data Analyst para uno de nuestros mejores clientes en Madrid:

Requerimientos:

Experiencia trabajando como Data Analyst
Experiencia trabajando con Python (código para leer e interpretar código, automatizar procesos)
Experiencia trabajando con Pyspark.
Persona comprometida y colaboradora
Conocimientos de herramientas de BI: Microstrategy
Conocimientos de Machine Learning
Conocimiento de herramientas de desarrollo (ID)
Soft Skills:

Capacidad de resolución de problemas de forma autónoma.
Skills comunicativos (estarás en contacto con negocio).
Habilidades para representar y resumir información sacando conclusiones de valor.
Detalles del Proyecto:

Modelo hibrido, 3 días en oficina por semana en Madrid.
Proyecto a l/p.
Start Date: ASAP",,Hybrid,"Extraer, transformar y cargar (ETL), Bases de datos, and Análisis de datos",Full-time · Entry level
https://www.linkedin.com/jobs/view/3498923510/?eBP=CwEAAAGH0jzD2TNShMlr6Si8Mv6st8ClvKcVgtNkvFryQdSikpkLq0x-nvn1jWoWqptek46CWxKGhZjAyWPqR3xIoYdvc7yK9Szm00K0xf38Q1voWEEwhZA9xDnKC87SHkG66sWW1jNLgnuDhLXsu868xf9VlHZooIGDTL0lRUJm5dOlVfsZEDhf8NDa2hAkO6eHKEP0IDfKHMyrqjeG-IdDmNf7j6mXzlnT8m4VQjZ20poJKs79bHL0c3zsnGZ1Iu6X_8EkkGTtvm3Vl4Vl_opbx3w5QmL-6rVm1vvOJStZzN67xQTraOH6UbDe5oD-Phvl9Xit-BmZI8pXEbZPJTqgR42cYVkfZA-P13W7As2osfmCrvF1s_GrMLS8GjcmfiVuG3GWPJk&recommendedFlavor=SKILL_ASSESSMENTS&refId=ufquHJ%2F05o3zvsRg7oyA3Q%3D%3D&trackingId=OAhzy%2FO4NLFBkZ6yUPBOsw%3D%3D&trk=flagship3_search_srp_jobs,Data Analyst,Product Madness 📱🎮,"About the job
Company Summary

Product Madness is a Global Powerhouse where the greatest mobile games and experiences are crafted by world-class talent. A top-grossing leader in free to play mobile games, we have more than 800 team members working across seven global talent hubs including London (headquarters), USA, Canada, Spain, Poland and Ukraine. With remarkable hit games including Heart of Vegas, Cashman Casino, Lighting Link and Big Fish Casino, we boast more than 50 million active users and 400 million downloads and counting.

We are Mad about games and the way they bring people together, and that passion and culture is what brings us together as a studio, connects us with our partners we collaborate with, and is what links us to our sister studios across the world.

Product Madness is an Aristocrat Technologies company within its digital game’s division of Pixel United.

Job Posting Title

Data Analyst

Summary

We are growing our teams and this is an opportunity for you to join our sunny Barcelona office as a Data/Product Analyst. You will be working together with other product analysts and data scientists embedded in our games team. You will have a key role in defining, extracting and actioning product data from big datasets. Thus, covering the full scope of data mining to reporting. In addition you will also be responsible to show the impact of product data via dashboards and/or other means of visualisations to key stakeholders throughout the company.

What You'll Do

Why this role?

This role is intended to strengthen the craft of analytics in Product Madness and to ensure the game teams are making informed decisions based on actionable insights. Your key responsibilities will be:

Working closely with product and the game teams, implement tracking in games to capture player data and create reports that give further insight into player behaviour and product performance.
Form new insights and perspectives that inform decisions and help us continue to delight the people playing our games.
Produce reports and deliver insights that have an impact on the future direction of our games and the game roadmap.
Work with game teams and DWH to produce end to end data pipelines that empower end users.
Work closely with product and game teams to create reports and monitoring of daily KPIs.
Investigating issues in the Production environment, analysing and optimising existing product features and A/B tests.
Apply creative thinking towards designing, testing, verifying, and implementing solutions.


Why should you join us?

As well we having the ability to grow and develop your career and work for a people first business that looks after all employees, you will also get some amazing benefits + an outstanding salary

25 days per year + Christmas closure + BCN Bank Holidays + Birthday off
Flexibility of 1 hours at the start and end of the working day + Summer working hours
Yearly bonus scheme
Fully hybrid working arrangements to suit you
50€ Amazon voucher for your birthday
40€ via Uber Eats voucher every month - have a take a way on us
WFH allowance of 250€ (one off) to set up your home office
Cigna - Medical Insurance for all our employees.
GYMPASS - free gym membership
Basket of Fruit worth 25€ each month of fruit and veggies sent to your house.
F&B provided at designated PM Games/Social Nights
Referral Scheme of 5000€ per referral hired (to be paid after successful completion of probation period)


What We're Looking For

What we look for in you

Previous experience in a product or data analyst role
Strong SQL and Excel skills
Experience of standard reporting tools such as Looker/QlikView/Tableau/Power BI etc.
Working experience setting up and analyzing A/B-tests would be desirable
Strong in mathematics and quantitative analysis with a passion for numbers and data
Interested in gaming and the mobile game industry, any experience in these industries would be highly desirable
Fluent in English
A Masters degree in Computer Science, Data Science, Mathematics or a analytical field is preferred
Experience with Python and/or R would be ideal but not essential


Why Product Madness?

Product Madness is so much more than just a Pool table and a foosball game.

We believe in an honest and transparent approach with our teammates. Company wide weekly Town Halls, All Hands and strategy meetings are just a few ways in which we encourage an open and honest path to achieving complete transparency.

Despite a pandemic, there isn’t a day where we don’t feel connected to one another.

With frequent events, workshops, giveaways, slack coffee and donut sessions we have definitely brought on our office culture to this new virtual world of zoom calls.

We also try to cater for all our staff’s needs – be that a freshly brewed cappuccino made by our professional barista in our free coffee shop or by providing a bountiful supply of tasty snacks to keep us refueled and buzzing.

We love to organise plenty of social get-togethers and action-packed activity days, be it slipping inside an inflatable bumper ball for a mad session of football zorbing or throwing caution to the wind and traversing giddy treetop rope courses at Go Ape. On top of these team-building activities, our lunch and learn workshops, not to mention the lavish Christmas and summer parties, foster that ‘work hard, play hard’ mantra. Our offices are based in the heart of the metropolises of London and Lviv, surrounded by an abundance of diversity and inspiration to keep those ideas flowing.

Our Values

People First


We have the deepest respect for our people and their well being. We know they are exceptionally talented and will always have a choice. We want them to re-choose us every day. We are committed to building a culture where each person's voice will always be heard and addressed.
MAD for More


Always improving, innovating and never settling for the existing. We push all boundaries with courage and ambition to become the world’s best games company.
Champion Together We excel at what we do but yet remain humble and helpful to our teammates. We champion one another and hold each other to high standards without any egos.
Globally Inclusive


We are all Equal - regardless of the language we speak, where we live, our gender, religion or culture we come from. We want to build a global home, where everyone has the equal opportunity to make an impact.
Customer Focused


We always think from the customer's perspective - be it players or internal customers.

Improving their experience and joy is what drives us. Every client's success is our big win!

R0012841","Benefits found in job post
Medical insurance",Hybrid,"Capacidad de análisis, Análisis de datos, Analítica, Analítica de datos, and Visualización de datos",Full-time · Entry level
https://www.linkedin.com/jobs/view/3585964742/?eBP=JOB_SEARCH_ORGANIC&recommendedFlavor=ACTIVELY_HIRING_COMPANY&refId=ufquHJ%2F05o3zvsRg7oyA3Q%3D%3D&trackingId=bF6QgGYTEIKIx1Y54LBIIQ%3D%3D&trk=flagship3_search_srp_jobs,Data Analyst,Iberostar Group,"About the job
En Iberostar Group estamos buscando incorporar a un/a Data Analyst a nuestro equipo de Compras en Palma de Mallorca, pero antes de saber más sobre la posición, creemos que es importante que sepas un poco sobre Iberostar Group:

Somos una empresa 100% familiar (Concretamente, una familia de más de 30.000 empleados/as).
Tenemos presencia en 35 países y nuestras oficinas centrales están en Palma de Mallorca.
Nuestros valores son muy importantes para nosotros, todas nuestras acciones van acorde a ellos. (Pasión, Responsabilidad, Transparencia, Creatividad y Humildad).
Somos pioneros en turismo sostenible (Revisa nuestro movimiento Wave of Change para saber más).

Si esto te resulta interesante… puede que este sea tu sitio.


¿Cuál será tu misión?

Serás la persona de referencia para reforzar las capacidades analíticas y de reporting de datos de la Dirección General de Recursos en todo aquello relacionado con la descarbonización de la cadena de suministro y de las operaciones del Grupo Iberostar. Para ello, deberás recoger las necesidades de los departamentos de Compras y de Inversiones y Proyectos y trabajarás en colaboración con el equipo Digital/DATO de la compañía para asegurar la disponibilidad, la usabilidad, la integridad y la visualización de los datos.


¿Cuáles serán tus funciones?

Trabajarás con la información existente en los sistemas de información enfocados a la descarbonización de la cadena de suministro y de las operaciones para acelerar la transformación necesaria en las operaciones y desarrollar informes, cuadros de mando y visualizaciones interactivas sobre las plataformas específicas.
Realizarás analíticas descriptivas y analíticas avanzadas para aportar valor a los diferentes equipos y usuarios de negocio, identificar tendencias y anomalías en los datos, y reportar las correspondientes incidencias para su resolución.
Trabajarás con otros miembros de la unidad en el DATO (Data Analytics & Transformation Office), la integración, transformación y el modelado de datos.
Colaborarás con el departamento de DIGITAL para programar y configurar protocolos de extracción/envío de datos de/a plataformas de terceros.
Llevarás a cabo reuniones con diferentes interlocutores para comprender los objetivos y alcance de los proyectos e iniciativas así como registrarlas en la Gestión de Proyectos y la Gestión de Ticketing de la compañía según su tipología.
Colaborarás en los proyectos del departamento y responsabilizarse de ciertas tareas dando soporte a los Project Managers proporcionando orientación a los usuarios, revisando alcances y requisitos, realizando QA y evaluaciones de rendimiento, etc.
Colaborarás y resolverás solicitudes de la gestión de servicios.
Analizarás los procesos de negocio y determinarás cómo se pueden cambiar y/o mejorar los resultados.
Realizarás escenarios “what-if”.


¿Qué buscamos en ti?

Formación:
IT Programación - Ingeniería Industrial.
Preferiblemente Máster en análisis de datos.
Desenvolverse en Inglés sin dificultades a nivel oral y escrito.
Valorable Francés.

Conocimientos Específicos:
Experiencia en el uso de herramientas de BI (especialmente SAP Business Objects y/o PowerBI).
Conocimiento de datos estructurados, como entidades, clases, jerarquías, relaciones y metadatos.
Conocimientos en Web Services, APIs, SSIS, BBDDs SQL y/o Oracle.
Valorable conocimientos y servicios de los Clouds AZURE y/o GCP.
Conocimientos y experiencia con la programación de protocolos para el envío de datos.

Trayectoria y Experiencia:
Experiencia mínima de 2-3 años en un rol similar.



¿Qué beneficios tendrás?

Un paquete de atractivos beneficios como: descuentos en todos nuestros hoteles y en otros servicios y productos como seguro de salud, viajes, ocio y mucho más; ser miembro de la Comunidad Iberostar Vitality (nuestro programa de empresa saludable y de bienestar para el empleado que incluye clases de yoga semanales, gimnasio virtual, planes nutricionales, día de la fruta, etc. ).
Smart Working: Flexibilidad horaria y posibilidad de teletrabajo.
Oportunidad de progresión dentro de la compañía: variedad de oportunidades y proyectos que te permitirán desarrollar tu potencial y crecer profesionalmente todos los días, además de poder acceder a nuestro Campus Elearning desde tu primer día.
Trabajar en un entorno inspirador que apuesta por las personas, los valores y un modelo de turismo responsable.",,Hybrid,"Inglés, Francés, Capacidad de análisis, SQL, Análisis de datos, Gestión de proyectos, Inteligencia empresarial, and Microsoft Power BI",Full-time · Associate
