job_link,position,company name,job description,salary,workplace_type,skills,insights
https://www.linkedin.com/jobs/view/3484456412/?eBP=CwEAAAGH0iiZkW1t7SeQ4vPc9w4JFyALQwu8mZ6sYtmHP6xw4xw66Ik-jnh5QGJn3z37I_OqGR1nguaquSRdzlVy9FnWcfgbwveSJP1aB_jgHVNWhbAkFSVkiaebwliRYmHItGEXKXJ1hyW6gIPv6DyTkxCkewGqWBhbMUBXxPBPSR9GS7oqChfvzhlnS3iGCbtZYt-27o3DAdIQYETlyzJZjuLorhxv8aYZtpYMnCxRGUmGjG8YzqhiijGVvW2xVZMBFe8o-vDfOvrn1xpKZP02U7H9oGHM4KxThnc9HbnN0Lb81nKiR3rhhmIFk9DlWiNrGpzuSZeQ_oYVmF4iAAL1EdiShakh1QjSIw1-VnE25Ep48PIIfwKQnkbb6gJx5agqrf50cmx58mj3Aou4lpzEXi2cbSNG8RjF5A&recommendedFlavor=ACTIVELY_HIRING_COMPANY&refId=pwBcgSRj26epuKmt%2B33IWg%3D%3D&trackingId=EWs%2BJIoT4317zUnmOcqm5g%3D%3D&trk=flagship3_search_srp_jobs,Business Analyst,Deporvillage.com,"About the job
¿Eres un apasionado/a de la analítica y el marketing digital?

Entonces, ¡Ésta es tu carrera!

En Deporvillage, uno de los mayores e-commerce de España y líder en su sector, buscamos a alguien que le apasionen los retos, que tenga iniciativa y muchas ganas de liderar todo el desarrollo de la marca propia de Deporvillage.

Somos jóvenes, ambiciosos, emprendedores, dinámicos y muy trabajadores; y tenemos la suerte de contar con un equipo profesional y experto digno de la mejor de las competiciones.

¿A quién necesitamos en nuestro equipo?

Esto es una carrera de fondo y para seguir alcanzando nuevas metas y nuevos triunfos, necesitamos incorporar un/a Business Analyst, donde tu principal responsabilidad será el análisis de las métricas del área de negocio donde se incluye: marketing online, CRM, Pricing y Comunicación, para poder aportar propuestas de mejora y ayudar a tomar decisiones relevantes para el negocio basadas en datos.

Pensamos en una persona con experiencia previa en e-commerce, analítica y con clara visión de negocio y de cliente, capaz de aportar propuestas de mejora y detectar posibles desviaciones para actuar sobre ella.

Tus principales funciones serán:
Analizar el comportamiento del usuario, así como el tráfico, conversión y captación de nuevos usuarios
Desarrollar un análisis en profundidad sobre el comportamiento del cliente, para aumentar la frecuencia y retención de clientes.
Proporcionar soporte analítico, con enfoque en la orientación empresarial y en los proyectos asignados.
Proveer de análisis económicos y estratégicos, elaboración de informes y recomendaciones para la toma de decisiones.
Gestionar y supervisar el análisis de negocio para apoyar la toma de decisiones en la estrategia y en el negocio de las áreas de responsabilidad. Identificar y evaluar nuevas oportunidades de negocio e iniciativas para aumentar la creación de valor.
Seguimiento de los costes: cálculo de los costes para los distintos servicios, monitorizar los costes y desviaciones, identificar oportunidades de ahorro de costes y beneficios.


¿Qué te pedimos?
Que poseas una experiencia mínima de 3 años en puesto similar
Que tengas un enfoque “user centricity”
Que tengas experiencia gestionando proyectos en e-commerce
Que seas una persona con gran capacidad de analítica con alto volumen de datos
Que tengas visión de negocio y capacidad para aportar propuestas de valor
Que tengas conocimientos de Google Analytics UA y GA4 o plataforma similar
Que poseas experiencia en herramientas de visualización de datos como Power BI
Será valorable conocimientos en SQL

¿Qué te ofrecemos?
·Un ambiente de trabajo joven y dinámico
Participar en un proyecto referente en el área de e-commerce y en pleno crecimiento
Horario flexible
Posibilidad de 1dia/semana trabajo en remoto
Remuneración acorde valía del candidato

¿Dónde estamos?
Nuestras oficinas se sitúan en Manresa",,Hybrid,SQL and Capacidad de análisis,Full-time · Mid-Senior level
https://www.linkedin.com/jobs/view/3562630839/?eBP=CwEAAAGH0iiZkZfT2XEH48CJiYijeQuv2s8iPckE38rc6BQk6EKon9yngsKErTh1Cmg7M5GMSarAiqUaIsgYTgp6KmORjslM0Yq7J0Q3ot1Iolm3UPsfGEYJCcyfT3iXVXtGzTmLk288-VBotV_19XtNnSTKML820uYaKhrFTFj3CZF70TJoXNVC2crDfeVOQdidMBsfBqtrfbO1VH4f1fQeBfi9Ru5aUik0lQB1iXEFM2Rk9TQc2efOM0fmPZN_eicyqGJYWI1E1LPwil7wSAZvR6tKNu3LXiej6a7zCznndwexwPUF4L3lqsrZJ2bVFEhj2HUBQaHxF2qKI2SXYU-i56_0ZptKh1RjvXJTO6U-F0xnN8Tuf0k_-j1z0XwZzxz_IgPqiG0&recommendedFlavor=SCHOOL_RECRUIT&refId=pwBcgSRj26epuKmt%2B33IWg%3D%3D&trackingId=Pbytqd6FbGeFVgvZASa3%2Fg%3D%3D&trk=flagship3_search_srp_jobs,Analista de negocio,Securitas Direct by Verisure,"About the job


Securitas Direct es el líder del mercado europeo en la protección y seguridad de personas para hogares y pequeños negocios, aportando un servicio excepcional a más de 3 millones de clientes con un equipo de más de 18.000 empleados, presentes en 17 países de Europa y América Latina. En Verisure Securitas Direct hemos creado las innovaciones más disruptivas del mercado, las cuales se han convertido en estándar para la industria y el sector.

Nuestro ADN: Pasión, Compromiso, Innovación, Trabajo en Equipo, Confianza y Responsabilidad.

El puesto:

El candidato/a seleccionado/a reportará al Manager de WFM de Relación con el cliente y se encargará de la supervisión y optimización de los reportes internos y los principales KPI de eficiencia operativa, así como de análisis Ad-hoc en función a las necesidades operativas.

Funciones:

Análisis de los principales proyectos y KPIs del área para mejorar la eficiencia operativa.
Control de los KPI´s de actividad del Área.
Transformar, enriquecer y preparar los datos para su análisis y visualización en Cuadros de Mando.
Diseño, actualización y control de reporting diario, semanal y mensual.
Extracción y tratamiento de datos mediante el uso de la plataforma SAP Web Intelligence BO.
Participación en la recogida de requisitos para el diseño de los universos de BI de datos en función de las necesidades de negocio.
Comprobación y verificación de la autenticidad de los datos extraídos de diversas fuentes.
Construcción de modelos matemáticos que permitan tanto el análisis de los datos extraídos como la implementación de nuevas formas de hacer
Apoyar a los distintos departamentos del área de Relación con el cliente en análisis ad-hoc.
Aporte cualitativo de la información entregada

Requisitos:

Titulación universitaria superior: Administración de empresas, Ingeniería, Estadística o similar
Altos conocimientos de Ofimática (Excel, PPT, Access, Visio, Power BI)
Excelente manejo de herramientas informáticas estadísticas.
Conocimientos de Business Objects

Requisitos valorables:

MBA u otra formación postgrado en área financiera
Alto nivel de inglés, B2 valorable
Gestión de Proyectos
Conocimiento de técnicas de Machine Learning, Deep Learning
Conocimiento de lenguajes y herramientas como (Python, R, SQL)
Valorable SPSS Modeler, Amazon Sage Maker",,Hybrid,Gestión de proyectos and Resolución de problemas,Full-time · Mid-Senior level
https://www.linkedin.com/jobs/view/3580166561/?eBP=JOB_SEARCH_ORGANIC&recommendedFlavor=IN_NETWORK&refId=pwBcgSRj26epuKmt%2B33IWg%3D%3D&trackingId=CK8ynTrHIFgrnAxZRNNoSg%3D%3D&trk=flagship3_search_srp_jobs,Business Analyst (They/She/He),Glovo,"About the job
About Glovo

We’re a Barcelona-based startup and the fastest-growing delivery player in Europe, Africa, and Western Asia. With food at the core of the business, Glovo delivers any product within your city at any time of day.

At Glovo, you’ll have the job of your life while working together towards our shared vision to give everyone easy access to anything in their city. We welcome top performers that will bring new ideas, diverse perspectives, and provide you the opportunities and freedom to grow and make a real impact on millions of lives… all while having fun!

We believe that diversity adds incredible value to our teams, our products, and our culture. We know that the best ideas and solutions come by bringing together people from all over the world and by fostering a culture of inclusion where everyone feels heard and has the chance to make a real impact. It's because of this that we are committed to providing equal opportunities to talent from all backgrounds.

In your application, please feel free to note which pronouns you use (For example: she/her/hers, he/him/his, they/them/theirs, etc).

Your Work-life Opportunity

We are looking for a passionate, proactive, data-driven and hands-on professional to support our Live Operations Analytics department in our headquarters in Barcelona. You will act and operate as a startup within a startup, providing both strategic thinking and analytical skills to help building excellence in Operations with focus into one specific region

Be a Part Of a Team Where You Will
Understand the operations model in Glovo to provide advice to the different teams
Contribute to the business discussion by suggesting different and novel analysis approaches
Translate business queries into quantified & insightful reporting and KPIs to assess performance and determine the effectiveness of the implemented initiatives
Ensure scalability of the reporting
Own creation and structure of Live Operations KPIs, ensure they are properly implemented in the DDBB
Define and design dashboards to give visibility to the top-management of the Live Operations performance
Follow a data-driven decision-making process
Report to the Operations Analytics Manager
You Have
Bachelor in Engineering, Maths/Physics
1-2 years of experience working on analytics in a similar/relevant industry
Demonstrated proficiency in working with clean & optimized SQL, querying mid to large volumes of data
Consulting experience is a plus
Python is a plus
Good understanding of how to extract insights from Data Warehouses
Ability to summarize and represent data (e.g descriptive statistics and graphs)
Ability to create robust, insightful, and story-telling visualizations using modern BI & Analytics tools and ability to identify data Issues
Excellent problem-solving and analytical skills
Comfortable working in a high growth and high performance start-up with a fast pace
Itchy feet and continuous thrive on learning through different projects
Professional English
We are always looking for the best candidates, so if you think you would be a good fit even if you don't meet 100% of the requirements we would love to hear from you!

Experience Our Glovo Life Benefits
Enticing equity plan (if applicable)
Top-notch private health insurance
Monthly Glovo credit to spend on our restaurant products and zero delivery fee on all Glovo orders!
Discounted gym memberships
Flexible time off (take the time you need) and hybrid working model (own your time)
Enhanced parental leave including nursery support!
Online therapy and wellbeing benefit
What You’ll Find When Working At Glovo
Gas: Driven to deliver quality results quickly
Good Vibes: Bring positivity and communicate openly
Stay Humble: Self-aware and open to learning
Care: Uplift people and the planet
Glownership: Act as proud owners
High Bar: Focus on Top Performance
If you believe you match these values, we look forward to meeting you!

Wanna take a peek into what it's like to work at Glovo? Follow us on Instagram and like us on Facebook!

Glovo is transforming the way consumers access local goods, enabling anyone to get almost any product delivered in minutes. Our on-demand logistics connect customers with independent local couriers who acquire goods from any restaurant or store in a city, as well as deliver urgent packages for a variable fee. For additional information on Glovo, please visit https://about.glovoapp.com/","Benefits found in job post
Medical insurance",Hybrid,"Analítica, SQL, Resolución de problemas, Capacidad de análisis, and Comunicación",Full-time · Mid-Senior level
https://www.linkedin.com/jobs/view/3581738495/?eBP=CwEAAAGH0iiZkXerB9N-42pLDdQkn3-mlQftgldn0oTo2-HYIgNGWTN5AWlVRAjahThFNyr3iUqW0yVt-nKNAlhGCRBtOYLjpOAEJnEPpCL0rzOfCLP0pEM4xi170qgk7D_M0mFrNG8icmeM5BQMgDoH-zDhMNtU1DElPqAOvUVAim_Nrns8hj22pDhXyiJ44W1JWsUiBtFJvTbf8iaYDtX4QFFgbBf6axO-DdDiaOke-KIBmqA-hUUGapk6w26CAO2xqLGu8n9w_Zu-sy7Uk_540tV_W5Qr6SEtIxgXSUnMtBEuIoHOL5m1p6FU8BTAMalSMGzzFn8YotqopyeYvmoe1vNOKmo3lqhDKr9L3YjogEeszvaMtodh7vm18RPXeXFlMI7fQ78&recommendedFlavor=ACTIVELY_HIRING_COMPANY&refId=pwBcgSRj26epuKmt%2B33IWg%3D%3D&trackingId=CaFpZKTBj3bJLe0od4Hd3w%3D%3D&trk=flagship3_search_srp_jobs,Data Analyst,Dedalus,"About the job
We are currently looking for a Data Visualization to join our fast-growing team in Iberia to set of processes required to provide a solution that allows us to analyze how our business is performing. This knowledge will allow us to optimize this performance by making relevant decisions.

In this role, you will be responsible for the process of extracting, organizing, analyzing, sharing, and monitoring the information that data offers to support decision-making and business management in the healthcare world.

It will be an amazing and exciting opportunity to learn about the healthcare systems and culture and expand the solution coverage.

Do you want a job with a meaningful purpose? Do you want to make healthcare safer, better, and more reliable? Have a look at the opportunities to join our Dedalus community.

About Dedalus:

Dedalus is the leading healthcare and diagnostic software provider in Europe and one of the largest in the world with an approach focused on the continuum of care to provide complete and patient-oriented future-proof solutions to the healthcare industry.

Thanks to our portfolio of leading next-generation solutions, Dedalus covers the entire spectrum of the continuum of care, and today we support over 6,300 healthcare organizations and 5,700 labs and diagnostic centers. Our software solutions are used widely across the world, serving 540 million of population.

Today, Dedalus employs more than 6,600 highly skilled qualified people; it has the largest software R&D team in the industry in Europe representing the 38% of the overall workforce. Our company fosters a culture where employees are encouraged to learn and innovate, and to enable and enhance clinical co-operation and processes while making a meaningful difference for millions of people around the world.

We are looking for people who want to be part of our purpose-driven company and follow our vision to drive a digital-enabled healthcare ecosystem to provide better care in a healthier planet!! If you are passionate about digital technologies and want to improve healthcare delivery around the world, it is the best time to join Dedalus Spain.


About you:
Responsibilities:
Creation of ETLs
Implementation of indicators
Internal and customer data validation
Documentation

Required Skills:
Bachelor’s degree or equivalent in Computer Engineering, Biomedical Engineering, or a related area of study
5-7 years experience in Data exploitation projects in the healthcare sector
2 years experience in Data exploitation projects in the healthcare sector
Ability to communicate with the client's functions
Proven experience in: health management data models; relational databases and SQL development
Visualization tool Power BI
ETL design tools (preferably Pentaho)
Desired experience in implementation of clinical processes in clinical history projects
Desired master in analytics or big data
Ability to work in a team


Why Dedalus for you?
Career development: you will have the opportunity to participate in exciting international process, have access to continuous training's programs, real internal opportunities for you to grow, and yearly performance reviews.
Healthy work and flexibility. You’ll be in a company with flexible working schedule, hybrid working style and 23 vacation days per year.
Multicultural environment in a purpose-driven company. You will work on the European market leader company in digital health to contribute to transform healthcare ecosystem though cut-edge digital technologies.
Diversity and inclusion. We work every day to leverage the richness created by diverse people and teams, where the special perspective of each individual member counts.


All our jobs are open to people with disabilities.


#WeAreDedalus#Together4Success#LifeFlowsThroughOurSoftware


Al inscribirse en esta oferta queda informado y consiente el tratamiento por parte de GRUPO DEDALUS, de los datos personales que ha facilitado voluntariamente a través de esta plataforma con la finalidad de gestionar su participación en procesos de selección (presentes o futuros).

El Usuario debe leer atentamente nuestra Política de Privacidad y el Aviso informativo para solicitantes de empleo, que ha sido redactado de forma clara y sencilla para facilitar su comprensión y están disponible en https://www.dedalus.com/spain/es/privacidad/.

En el aviso informativo para solicitantes de empleo, también podrá conocer las finalidades y plazos de conservación de los datos y cómo y dónde ejercer sus derechos de acceso, rectificación, supresión, limitación, oposición y portabilidad de los datos personales.

En la mencionada página web encontrará también toda la información sobre la protección de datos en DEDALUS.




En Grupo Dedalus estamos comprometidos con la igualdad de oportunidades y la no discriminación por motivos de sexo, edad, raza, religión, discapacidad, orientación sexual, identidad de género o ideología política. Por ello, evaluamos las candidaturas a nuestras ofertas de empleo únicamente en base a conocimientos, aptitudes, habilidades y experiencias, aplicando en todo momento la normativa vigente relativa a la igualdad de género entre mujeres y hombres (Real Decreto-ley 6/2019 y su normativa de desarrollo.)",,Hybrid,"Análisis de datos, SQL, Analítica de datos, Trabajo en equipo, Comunicación, Inteligencia empresarial, and Capacidad de análisis",Full-time · Mid-Senior level
https://www.linkedin.com/jobs/view/3569521870/?eBP=CwEAAAGH0iiZkeUgr2pRzN5C-OcwCDJh4gjC4LoJf-NL5x0JE4RH8Zwbwn-Mn_a3Og0adZSl7_lnZpbaaVFmE41CY_m55j7TMrTe4_Nmxqe3NqTVjgwQAykI5_I-GSLJW7CE7FAenRBdTvhZQM0C30yf2fnwgwA1f4hUFnzQuzvK-fQ3W3A8rS2ITkbQ2CQXzN8raYVBFk06fAtvHIbVvZ_-680utIMNJAswIgjmEO8Mcw2IDiIWhDdosTvOh3mxrkwQ66Le48lSva-1WOgtMUT1c2zzuf3SzvDdXiCRBAye_PPvnMjjuTiakB_TsBw22JqkB9PgZnbi51xaDuAj3UcmFpIoPlUjbcADYKsU6eu4PGnTqE1sMWY7A4C0dUoX4zOWikTLToAekw&recommendedFlavor=ACTIVELY_HIRING_COMPANY&refId=pwBcgSRj26epuKmt%2B33IWg%3D%3D&trackingId=AFUOeURos5kAgpfHD1v%2F9Q%3D%3D&trk=flagship3_search_srp_jobs,Business Analyst,NBCC Consulting,"About the job
Responsibilities
Performs feasibility analysis, scopes projects, and works with the project management team to prioritizes deliverables, and negotiate on product functionalities.
Creates detailed Business Requirement Document (BRD) and translate it into functional specifications.
Provides analytic support by coordinating data extraction from various databases and data interpretation.
Partners with development and analytic teams to provide reporting on software solutions.
Participates in Integration Testing and User Acceptance Testing (UAT) and Functionality Testing.


Qualifications
+4 years of experience
Experience in documentation
Experience in functional analysis
Experience in technical analysis
Knowledge in PowerBuilder, Sybase, client/server or at least knowledge of SQL.
Proactive and good communicator
Understanding of systems engineering concepts
The ability to conduct cost/benefit analysis Business case development
Modeling techniques and methods
English C1

It would be desirable:
Functional knowledge in commercial, logistics, production, Editorial and PIM.
Experience in the publishing sector


Following the EU General Data Protection Regulation No. 2016/679, we inform you that by responding to this announcement, you consent to the use of your data by the NBCC Group for as long as necessary. In case of doubt or request for elimination of your personal data, please send an email to geral@nbcc-consulting.com",,Hybrid,"Inglés, Capacidad de análisis, and SQL",Full-time · Mid-Senior level
https://www.linkedin.com/jobs/view/3585284299/?eBP=CwEAAAGH0iiZkXt225aYrTrfk0YSy_gbk7gMZQwxsk7R8N-dHPl2M60GLzfy7mnT-7sbjAoWGXhq-sEZrAtcppSzrCZjGBmUbPnopNJ5WPaePtKi660q0zP3TT4It9USxmzzoV5Ot1STdmwwZKCYEUT_bSnfvwuMbP7wMlzR6CGWvOK-zrhx6oBwmE4zuHZ6j1RALjvpewJ6uNK6TlH09Diks4NxT4-9cq789ScMzFJ2f4zAtXyIozpFY9s1NSbzXpnVY-Tqh0onuFCejohVfpkvn-JS8ANqwmpIHCdg9nYd9cZ_UhkL7DxAeSWjZs2U_uTwMyO4F33f_WVlJkqsp7ht1iy1JEzGW9nheUY_YmtAkjN84_JLOfAdckswKbJ347F0P49NUb8&recommendedFlavor=SCHOOL_RECRUIT&refId=pwBcgSRj26epuKmt%2B33IWg%3D%3D&trackingId=MCqx6dQfzj1VJdupKv7GZw%3D%3D&trk=flagship3_search_srp_jobs,Business Analyst,HCLTech,"About the job
HCLTech is an Indian-born global technology company helping companies reinvent their businesses for the digital age. HCL provides end-to-end services across industry verticals to leading companies, including 250 of the Fortune 500 and 650 of the Global 2000.

Our goal is to strengthen the brand in Spain. We are looking for an expert to work as Business Analyst!

Description:

We are seeking a highly skilled business analyst with a strong background in the finance sector, IT, Agile methodology and experience in robotic process automation (RPA) and business process management (BPM). The ideal candidate will be responsible for driving process improvements, implementing innovative solutions, and providing critical insights to support our strategic initiatives.

What you'll do:

• Collaborate with cross-functional teams to identify business needs, gather requirements, and develop operational solutions to address complex financial and IT challenges.
• Analyse and optimize business processes through the application of RPA, BPM and any other IT solution ensuring efficiency, compliance and scalability.
• Leverage Agile methodology to manage projects, ensuring timely delivery of high-quality solutions that align with business objectives.
• Develop and maintain documentation, including process maps, user stories and functional specifications to ensure a clear understanding of requirements and solutions. Evaluate the success of implemented solutions, identifying areas for ongoing improvement and iteration.

Education level:

•University BSc. degree in finance, computer science, information systems or a related field

What do you need to know?

• 3+ years of experience as a business analyst in the finance sector, with a focus on IT and process improvement.
• Strong knowledge of Agile methodology and project management best practices.
• Exceptional analytical, problem-solving and critical thinking skills.
• Excellent communication and interpersonal skills, with the ability to effectively collaborate with diverse teams and stakeholders.

What do we value?

Intermediate English language level (B1)
Proven experience with RPA and BPM tools such as UiPath, Appian, Blue Prism, Pega or similar.

Important to note:

- If you have a valid disability certificate, Certificate of Disability in Force, please contact us.

Among HCL's principles we would like to highlight diversity and inclusion as a strength in our values and practices. To achieve all our objectives, it intends to attract, develop, and retain different profiles, assuming diversity as a key factor and differentiator of fundamental innovation in our organization. We welcome and value all people, and we are committed to the inclusion and sense of belonging of each person who is part of HCL.
HCL is an equal opportunity employer. All qualified applicants will receive consideration for employment without regard to age, ancestry, color, family or medical care leave, gender identity or expression, genetic information, marital status, medical condition, national origin, physical or mental disability, political affiliation, protected veteran status, race, religion, sex (including pregnancy), sexual orientation, or any other characteristic protected by applicable laws, regulations, and ordinances.",,On-site,"Capacidad de análisis, Comunicación, Metodologías ágiles, and Resolución de problemas",Full-time · Mid-Senior level
