job_link,position,company name,job description,salary,workplace_type,skills,insights
https://www.linkedin.com/jobs/view/3571652742/?eBP=JOB_SEARCH_ORGANIC&recommendedFlavor=IN_NETWORK&refId=QhaxIKTulWz2jg%2F6j%2B%2Furg%3D%3D&trackingId=Vd87fGQdjOjQJ8%2FsutxDsA%3D%3D&trk=flagship3_search_srp_jobs,Business Analyst,Odoo,"About the job
El departamento de Odoo España Business Service está buscando a profesionales como tú, que nos ayuden a cumplir nuestra misión: Liderar el mercado español de las ERPs, al mismo tiempo que nos damos a conocer y hacemos que las empresas sean más eficientes y productivas. En Odoo creemos en tu talento, y estamos dispuestos a darte confianza, autonomía y escuchar tus propuestas. Buscamos a una persona proactiva, con gran capacidad de aprendizaje y sobre todo, que tenga las mismas ganas que nosotros de hacer crecer este proyecto.

En qué consistirá tu trabajo...

Como Business Analyst, estarás en contacto directo con los clientes para ayudarles en el buen uso del software Odoo . Por lo tanto, tu principal rol será analizar sus necesidades, identificar puntos débiles o de mejora y ayudar a encontrar la mejor solución para cada unidad de negocio. Así pues, serás responsable de ofrecer la mejor solución de gestión a tus clientes.

Trabajarás en varios proyectos diferentes al mismo tiempo. En las primeras semanas, te involucras rápidamente en tus primeros proyectos recibiendo el apoyo de compañeros más experimentados. Irás aumentando progresivamente tu nivel de autonomía, al mismo tiempo que trabajas en equipo con grandes profesionales de diferentes sectores. Queremos destacar también, que no tendrás tiempo de aburrirte, ya que, ¡Cada proyecto es siempre diferente!

Además, impartirás sesiones de formación personalizadas. Por otra parte, serás un apoyo estratégico enfocado al crecimiento de nuestra red de socios a nivel mundial . En este sentido, te responsabilizarás de la formación de nuestros partner, a los que ayudarás a implementar los proyectos de sus clientes, y por tanto, a convertirse en expertos en Odoo.

El principal objetivo del rol Business Analyst es implantar nuestro software ERP, e impartir formación y asesoramiento personalizado para cada cliente.

Te ofrecemos...

Tendrás la oportunidad de trabajar con empresas grandes (Medium Market & Corporate). Tratarás con compañías de más de 100 empleados y gestionarás grandes proyectos a largo plazo, por lo que tendrás bastante capacidad de decisión. Además, te damos la posibilidad de formar parte de un equipo internacional dinámico y competente con el que podrás aprender, y consolidar tus conocimientos.
Además, con el tiempo tendrás la posibilidad de crecimiento dentro de nuestra empresa, pudiendo llegar a ser Director de Proyectos en una empresa líder a nivel internacional en el sector IT.
Desde Odoo queremos que sepas que no nos consideramos una compañía convencional con trabajos monótonos y aburridos que imposibilitan el desarrollo profesional y personal. Nuestra cultura empresarial pretende dejar rienda suelta a tu creatividad, por tanto las personas proactivas con gran imaginación son bienvenidas. Queremos que disfrutes de tu trabajo, y que sientas que eres una parte imprescindible de nuestra gran comunidad.

Responsabilidades
Implementación de proyectos (80% de tu tiempo)
Ganar la confianza de tus clientes
Analizar las necesidades del cliente y proponer soluciones
Implementar las soluciones acordadas (configuración y desarrollo)
Convierte a tu cliente/socio en un campeón de Odoo (formación)
Gestión de proyecto - Seguir el proyecto y comunicar su estado y las tareas en curso
Organización y seguimiento de las implantaciones de Odoo
Mejoras internas (20% de tu tiempo)
Feedbacks a los Product Owners para mejorar el producto
Coaching & Training
Feedbacks para la mejora de tu departamento

Requisitos
Hablar español e inglés fluido/ otro idioma será un plus
Multitasking
Buena capacidad de comunicación
Autónomo, flexible y proactivo
Afinidad con el mundo de la informática
Permiso de trabajo válido para España

Sera un plus si tienes....
Experiencia en la implantación de software de gestión (ERP)
Conocimientos técnicos (XML, Python, JS, HTML)",,Hybrid,Comunicación and Capacidad de análisis,Full-time · Entry level
https://www.linkedin.com/jobs/view/3575963987/?eBP=CwEAAAGH0kSL8Bcvm1hL-rsRIvLJiLWD39Rg-i3qDVAdpNDjVTIrNuo03aMGRBvG3QCXv-i5PmZFHl6qPG1xfooQ8e8XtPq3SrElWDdpmdDQod24c6VYgJPsC6olEIsDBPd6PJCNmko5jlK-p3Od5QwRD_7Nw2K0eENcrNPG0bFmD7A-UffGi5HVVZEdcF5hlx2rPGa0OeZyGWe_RsvW1twolOCgfGXyaCBKm662hs1wCe6SzSvd4G1uOdkyJ5c8itpg-fFDZ_LbSV3QfmnJ8hwBkudKGg5yIyPhOyKfm7Ze2247OFPGIFKKlbvPmtDPsJviCeFzl42MPzRgx8BIAibr1XrBECrjzOpHIPHfXrUHii-wnTKX18ntayXCL-yf-S_55c5Jae-mumEA&recommendedFlavor=ACTIVELY_HIRING_COMPANY&refId=QhaxIKTulWz2jg%2F6j%2B%2Furg%3D%3D&trackingId=jza46gD9aDW1LGOO8CuTYQ%3D%3D&trk=flagship3_search_srp_jobs,Consultor/a PowerBI,Clevertask IT Solutions,"About the job
¿Eres un apasionado de la tecnología? ¿Te gustaría impulsar la transformación digital de grandes compañías y liderar sus retos de innovación? ¿Lo tuyo son los datos?

Nos presentamos… Somos Clevertask, una compañía de 200 profesionales, que pertenece al grupo internacional ALTEN, líder en ingeniería y servicios IT, con 55.000 consultores y presencia en 30 países. Contamos con la solidez de un gran grupo y la cercanía y expertise para ser en el mejor partner de nuestros clientes. Estamos especializados en tecnologías cloud, especialmente en el mundo Microsoft y Citrix, y trabajamos en la transformación digital, la definición soluciones tecnológicas innovadoras, y el desarrollo para nuestros clientes.

Nuestros servicios:

Consultoría estratégica tecnológica
Transformación del puesto de trabajo digital
Migración de infraestructuras al cloud
Implantación de soluciones de seguridad cloud
Inteligencia Artificial y Machine Learning
¿Nuestros valores? Transparencia, cercanía e innovación en todo lo que hacemos, sin olvidar la excelencia.


¿Qué ofrecemos?

En Clevertask velamos por el bienestar del empleado y apostamos por un desarrollo 360º, animándolos a conseguir todo aquello que se propongan. De nuestra parte ofrecemos:

Horario flexible, jornada intensiva los meses de julio y agosto, y posibilidad de trabajar en remoto (modelo de trabajo híbrido)
Sistema de retribución flexible en guardería, transporte, seguro de salud y dietas.
Referral bonus, si traes a gente con tanto talento como tú.
Plan de carrera personalizado, para ello tendrás acceso a cursos de formación a cargo de la empresa y certificaciones oficiales.
Clases de inglés en remoto sin coste para ti.
Salario acorde a la experiencia aportada.

¿Quieres saber más sobre nosotros? Te invitamos a echar un vistazo en los siguientes vídeos:

Presentación sobre quiénes somos y qué hacemos en Clevertask: https://acortar.link/ff4VHq
Nuestro 10º Aniversario: https://youtu.be/LmrwP3orYe8

REQUISITOS MÍNIMOS:

¿Qué estamos buscando?

Buscamos a un/a Consultor Power BI para realizar las siguientes tareas:

Analizar y organizar datos en bruto.
Construir sistemas de datos y canalizaciones.
Extranccioón de datos mediante diferentes BBDD.
Transformación de datos con Power Query,SSIS
Representación gráfica en DAX
Hard Skills:

Experiencia previa como Consultor Power BI.
Experiencia con Power Query , Power BI
Conocimiento con modelo de datos estrella y copo de nieve.
Experiencias con BBDD SQL, Oracle
Desarrollo de ETL
Valorable:

Analysis Services (SSAS)
Integration Services (SSIS)
Azure
Data Analysis Expressions (DAX)
Data Governance
Inglés alto.
Soft skills:

Trabajo en equipo (Team Player).
Buena comunicación y capacidad de estar en contacto directo como focal point con cliente.
Buena capacidad analítica para la propuesta de soluciones técnicas.
Capacidad de trabajar en entorno dinámico y cambiante.
Orientación a resultados.
¡Estamos deseando conocerte!

Personas, equipos, proyectos. Todo empieza con la confianza.

#Greatpeople, #greatplace!",,Hybrid,Bases de datos,Full-time · Associate
https://www.linkedin.com/jobs/view/3569820131/?eBP=CwEAAAGH0kSL8Bm8Y_nFXC2kVWbQxHq4rBJ6rTUkD_5RJ-32Fp89iQMA7xsbOgI4pmK4-mc1V87iSqdjpaVc3J5uFK120Qu4pimYgAJfIsAA97hG_iNJFGQy8QuLU-wL5kR7Fx6W1vMnBBKEgtjVq-a-cv-a6bzoHpwNulR3rsiYcGDWkECfa4C2mfg5jURnjdqitSolZvj067Fa8midCG-l60krgoDDwxmXQEx8w2uQEInK0RDma2cWspLlK6Dp0JAL8SPUy9WqzEDZWk6VJ6dVeGJmOAEpl7ZshCQ0wRj5uzmj4FsnE5Kyv13k0ByOd2Ma9Gv28CVlRggp_xoghzvJLow_Oj4GwHn2e6w8cocNXYno6tQf8ujUK4it1egXvmBrE6Y91Kr83PTBn9k&recommendedFlavor=SCHOOL_RECRUIT&refId=QhaxIKTulWz2jg%2F6j%2B%2Furg%3D%3D&trackingId=xPb8tJgLme4AjK2fvc0NJA%3D%3D&trk=flagship3_search_srp_jobs,Junior IT Support Analyst,Arup,"About the job
About Arup

Arup is an independent company of engineers, architects, designers, consultants, and technical specialists offering a wide range of professional services.

It is the creative force behind some of the most important and innovative projects in today’s-built environment, both small and large in scale. With 90 offices in 35 countries, our more than 18,000 employees offer a wide range of professional services. Thus, through our work, we want to create a positive impact in our current environment.

We have been present in Spain since 1993 and we have a tea of more than 220 engineers, consultants, and qualified technical personnel. We work for clients from the public and private sectors, providing creative and sustainable solutions based on the efficient use of resources.

The role

We’re looking for an IT support analyst to be the front-door to technology services to the rest of the organisation. You will help to increase business productivity by taking a customer-focused, proactive and collaborative approach to anticipating and resolving technology issues. You will provide support and technical expertise to a range of issues relating to hardware, software, peripherals and projects.

Working under the guidance of the local service lead, you will be part of a larger team that provides customer-focused digital services to Arup globally. This is a full time, level 2 support role in a typical IT support infrastructure, with a business-focused mindset.

We provide opportunities for all our people to develop their skills, along with challenging and innovative work in an environment that allows individuals to flourish. We believe in continuous learning; providing a culture that is naturally curious and always stimulating. One that promotes self-discovery and allows people time to be creative.

“ I enjoy the variety of my role - no two days are the same. One day I might be reassuring a nervous presenter minutes before they present to hundreds of colleagues via a live stream. The next day I might be trying to fix a laptop remotely with a colleague who has a looming deadline or showing them how to get the most out of the latest digital tools .” Caitlin, Brisbane.

Responsibilities Of The Role Include

Acting as client liaison for all Digital Technology-related requests from staff, being first line of engagement to understand and address issues and needs around desktop (Windows, O365 etc.) and infrastructure (compute, storage, network, cloud services, enterprise systems, cybersecurity, etc.), engaging and escalating to other Digital Technology teams as needed
Providing value added services to the business, working together with the leadership team to drive technology and help transform business activities
Configuring, deploying, maintaining, troubleshooting and supporting workstations, laptops, printers, mobile devices, phones and other computer and telecoms equipment
Solving problems associated with hardware (PCs, Macs, mobile, etc.), software, and services (video conferencing, remote access, etc.) determining the source of problems and classifying their level, priority and nature. When appropriate, escalating or routing them to the appropriate team
Helping with a range of office-based technology needs – installations, moves, changes, etc. that involve staff requirements and infrastructure needs, working collaboratively with other DT service teams
Responding to, documenting and resolving service tickets in a timely manner according to an agreed service level
Documenting procedures, standards, best practices configurations, settings, installation sequences and back-out instructions
Following ITIL/Service Management policies and procedures
Helping the software asset management team to maintain applications (license management and version control)
Helping with communications and training around technical change
Playing an active part in our team: helping to build an inclusive environment, sharing your knowledge and promoting best technology practices with colleagues

Some of the technology you could expect to support includes:

Personal computing (HP, Mac, etc.)
Mobile computing (iPhone, iPad, Samsung etc. depending on office or regional policy)
Microsoft Windows Operating System, Mac OSx (limited)
Microsoft 365 and associated services (i.e. OneDrive for Business, MS Teams, etc.)
Cloud based solutions (Azure, AWS, etc.)
Video conferencing hardware/software based on global standards
Office printers and copiers (these vary depending on office or regional policy)

Please don’t be discouraged if you don’t meet every point below – if you meet most, and are strongly motivated by the role, and willing to learn, we are still interested in hearing from you.

Minimum Requirements

Some (1 to 2 years’) experience working in a regional or global organisation providing desktop support services in a Microsoft environment
A desire to learn, you should have a track record of developing your technical knowledge and applying new skills in a high paced environment
Good analytical skills, with ability to solve problems and openness in sharing your knowledge and thinking with others
Experience of ServiceNow or similar IT Service Management systems
Some experience working in a professional services organisation

Assessable Requirements

Familiarity with MS Teams and O365
Familiarity with technical software solutions from Autodesk, Bentley, Trimble, etc
Familiarity with software solutions from Adobe, Bluebeam, Cisco, Symantec, etc

Conditions

Immediate incorporation

How to apply for this vacancy?

To apply for this vacancy, register your updated CV and a cover letter in English.

Why work at Arup?

We work on innovative and international projects collaborating with different disciplines and offices around the world
We offer flexible check-in and check-out hours and a hybrid work model
You will have the possibility of living a professional experience abroad, through our international assignments
We have continuous training through our Arup University platform, LinkedIn Learning licenses and access to virtual English/Spanish classes
We are committed to equal opportunities through the objectives established in our equality plan
You can participate in groups such as EDI (equality, diversity and inclusion), Community Engagement (commitment to different communities) and Ovagreen (commitment to the environment)
We promote a healthy life among our employees through subsidies with different sports centers, inter-company leagues, tournaments, free daily coffee, tea, local fruit...
We allocate several of our profits to knowledge at work, with the possibility of financing research through the Invest in Arup program
We are committed to a young and dynamic work environment, in which juniors and seniors share values and learn from each other through internal activities
We contribute part of our annual benefits to solidarity projects, such as the design and construction of various buildings and infrastructures in developing countries
The independence of Arup as a company allows us to share with all Arupians a part of the profits obtained globally twice a year
Arup is, according to the ranking of Actualidad Económica, El Mundo, one of the best companies to work for in Spain in 2022

What are we searching for?

At Arup we place sustainability at the heart of our projects and invest in research and development to address issues such as climate change and poverty. We have committed to achieving the goal of net zero emissions by 2030 and making a significant contribution to the United Nations Sustainable Development Goals.

Therefore, we look for people who share these concerns and interests, creating shared value for our customers and our communities while safeguarding our planet. Arup commits to net zero across global operations by 2030 - Arup",,Hybrid,Comunicación and Resolución de problemas,Full-time · Entry level
https://www.linkedin.com/jobs/view/3582145605/?eBP=JOB_SEARCH_ORGANIC&recommendedFlavor=SCHOOL_RECRUIT&refId=QhaxIKTulWz2jg%2F6j%2B%2Furg%3D%3D&trackingId=F0b%2B91n1os4OgF3C3x4QnA%3D%3D&trk=flagship3_search_srp_jobs,Data Analyst Sector Energético (Madrid/Barcelona) - ID 8001,Naturgy,"About the job
Somos un grupo energético multinacional e innovador, presente en más de 20 países. Nos dedicamos a la generación, distribución y comercialización de energía y servicios, comprometidos con el bienestar de las personas, el progreso de empresas y sociedad, y la sostenibilidad del planeta.

El negocio de Comercialización desafía el reto del crecimiento; despuntando en competitividad, reinventando la relación con el cliente, acelerando la digitalización y la generación distribuida para impulsar la energía renovable.
Necesitamos personas de acción, con ganas de aprender, sin miedo y con entusiasmo para evolucionar mirando al futuro.

¡Queremos ser los mejores en lo que hacemos! Trabajando en equipo, haciendo más con menos y desarrollando a cada persona, para crecer juntos tanto en el ámbito comercial como en el de otros negocios, gracias a las oportunidades de movilidad interna del grupo Naturgy.
¿Te apuntas al desafío?
En este contexto buscamos talento para la posición de Data Analyst Sector Energético
Como Data Analyst Sector Energético serás parte de este reto ilusionante donde los datos están en la base de las decisiones de negocio orientadas a la consecución de los objetivos estratégicos de la compañía, en diversos ámbitos de la comercialización de energía y servicios energéticos.
Los retos de tu día a día estarán orientados a:
Desarrollo y generación de procesos ETL para la carga y transformación de la información origen, permitiendo la creación de informes.
Realización de análisis avanzados que faciliten la toma de decisiones, desde la propuesta de requerimientos hasta la presentación de resultados.
Identificación y generación de variables sintéticas asegurando la coherencia en las extracciones entre las diferentes fuentes de información de la compañía.
Automatización de procesos con herramientas de perfil DevOps (AWS Lambdas, Azure Functions ,Git, Athena, …).
Utilización de herramientas de query/reporting, creación de informes y consultas a bases de datos con SAS, SQL, Power BI, QuickSight.
Desarrollo y mantenimiento de modelos predictivos y su explotación en entornos cloud para su consumo (Sagemaker AWS, Glue Jobs,..).
Lo que necesitas:
Requisitos Obligatorios
Titulación: Grado superior en Estadística, Matemáticas, Informática, Ingeniería, ADE, Física o Física Aplicada.
Tener conocimiento de lenguaje de programación orientadas a BBDD (SQL, PL-SQL, SAS) y para análisis estadísticos (Python, SAS, R).
Habilidades obligatorias en herramientas de visualización de datos (Power BI, QuickSight).
Experiencia mínima de 2 años en análisis de data.
Habilidades para la comunicación y presentación de datos de manera efectiva, para que los análisis puedan ser comprendidos y utilizados por personas que no son expertas en datos. Esto incluye diseñas informes y dashboards en equipo con otros departamentos de la empresa.
Idiomas: Inglés (mínimo C1).
Requisitos Valorables
Conocimiento del sector energético
Experiencia en proyectos con tecnología Cloud (Azure, AWS).
Valorable un segundo idioma.
Lo que ofrecemos
Trabajar en un equipo colaborativo y multidisciplinar.
Ambiente que promueve la diversidad e igualdad.
Programa formativo y de desarrollo.
Compromiso con la conciliación y la flexibilidad, con formato de trabajo híbrido.
Espíritu innovador en un entorno retador y motivador.
Networking y trabajo en equipo con ubicación en Madrid.
¿Te apuntas al desafío?
1) Rellena el formulario con tus datos. Para completar el perfil, te recomendamos adjuntar tu CV actualizado y certificado de inglés.
2) Si cumples el perfil contactaremos contigo para participar en las diferentes pruebas y entrevistas.
3) Si avanzas con éxito en el proceso ¡te damos la bienvenida al equipo Naturgy!

¡Inscríbete y atrévete a impulsar tu energía y acelerar tu futuro con Naturgy!",,Hybrid,"Python, Inglés, and Capacidad de análisis",Full-time · Associate
https://www.linkedin.com/jobs/view/3569070203/?eBP=CwEAAAGH0kSL8DMSlMfDF95ei-qZfjoLNa_zwPt0EGy31o-ZNaSk_Fx2Jw-3P-6YVOs36zxBXy6GHlA3GZYoNuEfnt1CeF5GNWHE7SHdrHuL0g5MwPDW5i2q43ACbzLyF9gMJecfzDaEOCYABSJ_wc0mZjZRvmLraiRC8dv9_YzSg9o72QQpmEfMhGVvNlTPPg1kKFJC3d3blY895OfPk3QhaZFWZBJz85ODJr65IBHFc3WRVAnFtbPwISDtBTXxbP5rD9-EzbZqcUlu79GQAxhAgIufWy4iAKk8mjz9vgw-orvof3_ltFnqPGeoLkpkbVM0cepadk5DsVUVHPJbbyHtwD-q9furn22Ad_Z-6hn30VNoHi_3qExjz7_C3iKRdjQw-rihAvStp5sFYggQ4GcYzE-jZZ2wdFA3_PCT&recommendedFlavor=ACTIVELY_HIRING_COMPANY&refId=QhaxIKTulWz2jg%2F6j%2B%2Furg%3D%3D&trackingId=aPRtmigP0bk8se3UyVMixw%3D%3D&trk=flagship3_search_srp_jobs,Power BI Specialist (m/f/d),DEHN digital solutions GmbH,"About the job
Job Summary
As a business intelligence specialist within the data and analytics center of excellence, you will design, develop, and maintain DEHN's data visualizations in Microsoft Power BI. You will design intuitive, effective, and actionable visualizations to support data-driven decision-making.
Key Responsibilities
Develop and maintain Power BI data models, reports, and dashboards connecting to the cloud data warehouse (Azure Synapse) which is collecting data from various sources such as SAP ERP and Microsoft Dynamics CRM as per the DEHN standards
Communicate trends, patterns, insights, findings, and recommendations to non-technical stakeholders using data visualizations and storytelling
Optimize report performance and troubleshoot issues as they arise
Identify opportunities to improve data quality and optimize data processing procedures
Qualifications
Bachelor's degree in computer science, data science, or a related field is preferable
3+ years of experience in Power BI or related data visualization tools
Proficiency in SQL, DAX, and Power Query
Strong understanding of data visualization principles
Knowledge of data modeling and best practices in performance improvement
Fluency in English is a big advantage
If you are a motivated individual with a passion for designing and developing effective data visualizations to help DEHN make better-informed decisions and achieve our business goals, we encourage you to apply for this exciting opportunity as a Power BI Specialist.",,Remote,"SQL, Visualización de datos, Inteligencia empresarial, Inglés, and Microsoft Power BI",Full-time · Associate
